{
  "version": 2,
  "name": "aaa",
  "alias": "aaa.now.sh",
  "schema": "nnn",
  "env": {
    "aa": "aa",
    "NODE_ENV": "production"
  },
  "build": {
    "env": {
      "ab": "ab",
      "NPM_TOKEN": "a"
    }
  },
  "builds": [
    {"src": "aaa", "use": "@now/bash"},
    {"src": "aaa", "use": "@now/next"},
    {"src": "aaa", "use": "@now/bash", "config": {"maxLambdaSize": "15mb"}},
    {"src": "*.html", "use": "@now/static"},
    {"src": "*.js", "use": "@now/node"}
  ],
  "routes": [
    {
      "src": "/custom-page",
      "headers": {"cache-control": "s-maxage=1000"},
      "dest": "/index.html"
    },
    {"src": "/api", "dest": "/my-api.js"},
    {"src": "/users", "methods": ["POST"], "dest": "/users-api.js"},
    {"src": "/users/(?<id>[^/]*)", "dest": "/users-api.js?id=$id"},
    {"src": "/.*", "dest": "https://my-old-site.com"},
    {"src": "/legacy", "status": 404},
    {
      "src": "/redirect",
      "status": 301,
      "headers": {"Location": "https://zeit.co/"}
    }
  ]
}
